{
  "$schema": "https://json-schema.org/draft/2020-12/schema",
  "title": "Rig",
  "description": "Процедурный риг персонажа из частей-слоёв. Все части — полнохолстные спрайты в одних координатах; pivot задаёт точку вращения.",
  "type": "object",
  "required": ["id", "canvas", "anchor", "parts"],
  "properties": {
    "id": { "type": "string" },
    "description": { "type": "string" },
    "canvas": {
      "type": "object",
      "required": ["width", "height"],
      "properties": { "width": { "type": "integer", "minimum": 1 }, "height": { "type": "integer", "minimum": 1 } }
    },
    "anchor": {
      "type": "object",
      "description": "Точка холста, которая ставится в позицию тела (ноги, низ по центру)",
      "required": ["x", "y"],
      "properties": { "x": { "type": "number" }, "y": { "type": "number" } }
    },
    "crawler": {
      "type": "object",
      "description": "Ползающее существо (паук): тело на двухфаланговых ногах",
      "required": ["body_raise", "legs"],
      "properties": {
        "body_raise": { "type": "number", "minimum": 0, "description": "На сколько px тело поднято над поверхностью ногами" },
        "leg_spread": { "type": "number", "minimum": 0, "description": "Множитель разноса стоп (1 — как в рисунке)" },
        "leg_splay": { "type": "number", "minimum": 0, "description": "Дополнительный разброс стоп наружу от центра тела, px" },
        "body_centre_x": { "type": "number", "description": "Центр тела по X на холсте (px); по умолчанию — якорь" },
        "legs": {
          "type": "array",
          "minItems": 1,
          "items": {
            "type": "object",
            "required": ["name", "upper_sprite_id", "lower_sprite_id", "hip", "knee", "foot", "gait_group"],
            "properties": {
              "name": { "type": "string" },
              "upper_sprite_id": { "type": "string", "description": "Верхняя фаланга (бедро -> колено), id спрайта-слоя" },
              "lower_sprite_id": { "type": "string", "description": "Нижняя фаланга (колено -> стопа), id спрайта-слоя" },
              "hip": { "type": "object", "required": ["x", "y"], "properties": { "x": { "type": "number" }, "y": { "type": "number" } } },
              "knee": { "type": "object", "required": ["x", "y"], "properties": { "x": { "type": "number" }, "y": { "type": "number" } } },
              "foot": { "type": "object", "required": ["x", "y"], "properties": { "x": { "type": "number" }, "y": { "type": "number" } } },
              "gait_group": { "type": "integer", "minimum": 0, "description": "Группа походки: ноги одной группы шагают одновременно" }
            }
          }
        }
      }
    },
    "wobbler": {
      "type": "object",
      "description": "Существо на фоне: тело и лапки — одна сетка со скиннингом; лапки ведёт цепочка костей, из пасти выплёвываются другие враги",
      "required": ["sprite_id", "mouth", "limbs"],
      "properties": {
        "sprite_id": { "type": "string", "description": "Полный рисунок существа (холст целиком) — текстура общей сетки" },
        "thread": {
          "type": "object",
          "required": ["sprite_id", "attach"],
          "description": "Нитка, на которой существо висит маятником: тайлится по вертикали, верхний конец закреплён на высоте anchor_y из уровня",
          "properties": {
            "sprite_id": { "type": "string", "description": "Кусок нитки (тайлится вдоль длины)" },
            "attach": { "type": "object", "required": ["x", "y"], "description": "Точка холста, к которой привязана нитка (макушка существа)", "properties": { "x": { "type": "number" }, "y": { "type": "number" } } },
            "width_center": { "type": "number", "description": "Центр нитки по x в куске (px), по умолчанию половина ширины" }
          }
        },
        "mouth": { "type": "object", "required": ["x", "y"], "description": "Откуда вылетают плевки (px на холсте)", "properties": { "x": { "type": "number" }, "y": { "type": "number" } } },
        "limbs": {
          "type": "array",
          "minItems": 1,
          "items": {
            "type": "object",
            "required": ["name", "sprite_id", "root"],
            "description": "Лапка: целый слой + корень; в игре режется на сегменты вдоль оси корень -> кончик и ведётся цепочкой костей",
            "properties": {
              "name": { "type": "string" },
              "sprite_id": { "type": "string", "description": "Полнохолстная маска лапки (какие пиксели рисунка — её)" },
              "root": { "type": "object", "required": ["x", "y"], "description": "Корень лапки (px на холсте): точка крепления к телу и начало первой кости", "properties": { "x": { "type": "number" }, "y": { "type": "number" } } },
              "bones": { "type": "integer", "minimum": 2, "maximum": 16, "description": "Число костей (сегментов), по умолчанию 6" }
            }
          }
        }
      }
    },
    "segmented": {
      "type": "object",
      "description": "Сегментированное существо (червь): голова, туловище, хвост едут по следу головы",
      "required": ["thickness", "length_min", "length_max", "head", "body", "tail", "head_to_body", "body_to_body", "body_to_tail"],
      "properties": {
        "thickness": { "type": "number", "minimum": 1, "description": "Толщина червя, px (центр ползёт на половине толщины от поверхности)" },
        "length_min": { "type": "integer", "minimum": 2 },
        "length_max": { "type": "integer", "minimum": 2 },
        "head": { "$ref": "#/$defs/segment" },
        "body": { "$ref": "#/$defs/segment" },
        "tail": { "$ref": "#/$defs/segment" },
        "head_to_body": { "type": "number", "description": "Расстояние между центрами головы и первого туловища вдоль следа, px" },
        "body_to_body": { "type": "number" },
        "body_to_tail": { "type": "number" }
      }
    },
    "parts": {
      "type": "array",
      "description": "Части снизу вверх (порядок отрисовки)",
      "items": {
        "type": "object",
        "required": ["name", "sprite_id", "role", "pivot"],
        "properties": {
          "name": { "type": "string", "description": "Имя слоя в .aseprite" },
          "sprite_id": { "type": "string", "description": "Id из data/sprites/sprites.json" },
          "role": { "type": "string", "enum": ["head", "torso", "arm", "leg"] },
          "side": { "type": "integer", "enum": [-1, 1], "description": "Для рук и ног: 1 — левая на экране (Fhand/Fleg), -1 — правая" },
          "pivot": {
            "type": "object",
            "required": ["x", "y"],
            "properties": { "x": { "type": "number" }, "y": { "type": "number" } }
          },
          "face": {
            "type": "object",
            "required": ["feature_colors", "max_shift"],
            "description": "Только для head: слой режется на череп и лицо (пиксели этих цветов — глаза, брови, рот); лицо сдвигается по черепу в сторону курсора",
            "properties": {
              "feature_colors": { "type": "array", "minItems": 1, "items": { "type": "string", "pattern": "^#[0-9a-fA-F]{6}$" } },
              "region": {
                "type": "object",
                "required": ["x0", "y0", "x1", "y1"],
                "description": "Прямоугольник на холсте (включительно), где искать черты: вне него пиксели остаются на черепе (например, трещина на шлеме и рот не двигаются — только глаза)",
                "properties": { "x0": { "type": "integer" }, "y0": { "type": "integer" }, "x1": { "type": "integer" }, "y1": { "type": "integer" } }
              },
              "max_shift": {
                "type": "object",
                "required": ["x", "y"],
                "properties": { "x": { "type": "number", "minimum": 0 }, "y": { "type": "number", "minimum": 0 } }
              }
            }
          },
          "gaze_origin": {
            "type": "object",
            "required": ["x", "y"],
            "description": "Только для head: середина глаз на холсте (px). Голова смотрит вбок (вперёд = +x по взгляду), поэтому она поворачивается так, чтобы взгляд от этой точки шёл на курсор",
            "properties": { "x": { "type": "number" }, "y": { "type": "number" } }
          },
          "length": { "type": "number", "minimum": 1, "description": "Только для leg: длина ноги от бедра до стопы, px" },
          "rope": {
            "type": "object",
            "description": "Только для arm: слой режется вдоль оси плечо→кисть на segments сегментов, поведение — физика каната",
            "required": ["segments"],
            "properties": { "segments": { "type": "integer", "minimum": 2, "maximum": 12 } }
          }
        }
      }
    }
  },
  "$defs": {
    "segment": {
      "type": "object",
      "required": ["sprite_id", "center"],
      "properties": {
        "sprite_id": { "type": "string", "description": "Слой-часть (полный холст); рисунок смотрит «вверх» = вперёд" },
        "center": { "type": "object", "required": ["x", "y"], "description": "Центр части на холсте (px) — точка вращения и позиции на следе", "properties": { "x": { "type": "number" }, "y": { "type": "number" } } }
      }
    }
  }
}
